{
  "$schema": "../../schemas/generated/comparatifs.page.schema.json",
  "title_fr": "Claude vs ChatGPT pour une PME : lequel choisir en 2026",
  "title_en": "Claude vs ChatGPT for an SMB: which one to choose in 2026",
  "description_fr": "Comparatif Claude vs ChatGPT pour une PME : forces, limites, coûts, sécurité des données et cas d'usage métier, pour choisir selon votre besoin réel.",
  "description_en": "Claude vs ChatGPT comparison for an SMB: strengths, limits, costs, data security and business use cases, to choose by your real need.",
  "slug": "claude-vs-chatgpt-pme",
  "publishedAt": "2026-06-29T00:00:00.000Z",
  "updatedAt": "2026-06-29T00:00:00.000Z",
  "category": "productivite",
  "tags": [
    "claude-vs-chatgpt",
    "comparatif-ia",
    "integrateur-claude",
    "securite-donnees",
    "outils-ia-pme",
    "productivite"
  ],
  "seo": {
    "noindex": false
  },
  "faq_fr": [
    {
      "q": "Claude ou ChatGPT : lequel choisir pour une PME ?",
      "a": "Cela dépend de votre besoin réel. Pour de l'assistance générale, de la rédaction grand public et un écosystème d'extensions riche, ChatGPT est excellent. Pour intégrer l'IA à vos outils métier, traiter des documents longs et garder un cadre de sécurité strict, Claude prend l'avantage. La vraie question n'est pas lequel est meilleur dans l'absolu, mais lequel sert le mieux votre cas d'usage prioritaire."
    },
    {
      "q": "Quelle est la différence principale entre Claude et ChatGPT ?",
      "a": "ChatGPT vise large : assistant polyvalent, génération d'images, voix, plugins, GPTs personnalisés. Claude est conçu pour le travail rigoureux sur texte et code, avec une fenêtre de contexte très large et le protocole MCP qui le branche proprement à vos outils. En clair, ChatGPT est un couteau suisse grand public, Claude un outil d'intégration métier."
    },
    {
      "q": "Lequel est le plus sûr pour les données d'entreprise ?",
      "a": "Les deux proposent des offres entreprise qui n'entraînent pas les modèles sur vos données. Anthropic met la sécurité et l'alignement au cœur de sa proposition, ce qui rassure sur les usages sensibles. Mais le vrai facteur de sécurité reste l'intégration : un déploiement cadré, avec une politique d'usage claire, protège bien mieux que le choix du modèle seul. C'est là que l'accompagnement compte."
    },
    {
      "q": "Combien coûtent Claude et ChatGPT pour une équipe ?",
      "a": "Les deux tournent autour de 20 à 30 € par utilisateur et par mois pour les offres pro, avec des paliers entreprise au-dessus. Le coût des abonnements est rarement le poste décisif. Le vrai coût d'une PME se cache dans le temps d'intégration, la formation et la maintenance des automatisations. Comparer les prix de licence sans regarder le coût total d'usage mène à de mauvaises décisions."
    },
    {
      "q": "Claude est-il meilleur que ChatGPT pour coder ?",
      "a": "Sur les tâches de code complexes, de refactor et de raisonnement sur de grandes bases, Claude est régulièrement préféré par les développeurs pour sa rigueur et sa fenêtre de contexte. ChatGPT reste très solide et son écosystème d'outils est riche. Pour une PME, l'enjeu n'est pas le benchmark brut mais la capacité à brancher le modèle à votre code et à vos process, ce que Claude facilite via MCP."
    },
    {
      "q": "Peut-on connecter Claude ou ChatGPT à mes outils métier ?",
      "a": "Oui pour les deux, mais par des voies différentes. ChatGPT s'appuie sur ses plugins, ses GPTs et des connecteurs. Claude utilise le protocole MCP, un standard ouvert qui le relie proprement à vos bases, votre CRM ou vos fichiers, sans bricolage. Pour une intégration durable et maintenable dans une PME, cette approche standardisée est un atout net en faveur de Claude."
    },
    {
      "q": "Faut-il choisir un seul outil ou les deux ?",
      "a": "Beaucoup de PME utilisent les deux : ChatGPT pour l'assistance individuelle au quotidien et Claude pour les agents intégrés à leurs process. Ce n'est pas incohérent. L'erreur serait de multiplier les abonnements sans cadre, avec des données sensibles qui circulent partout. Mieux vaut un usage cadré d'un outil bien intégré qu'une dispersion d'outils sous-exploités."
    },
    {
      "q": "Pourquoi Waimia recommande-t-il Claude pour l'intégration ?",
      "a": "Parce que notre métier est de brancher l'IA à vos outils, et que le protocole MCP de Claude rend ces intégrations propres, standardisées et maintenables. Cela ne disqualifie pas ChatGPT, qui reste excellent en assistance générale. Notre recommandation est nuancée : Claude pour les agents métier intégrés, et chacun choisit l'outil grand public qu'il préfère pour l'assistance individuelle."
    }
  ],
  "faq_en": [
    {
      "q": "Claude or ChatGPT: which to choose for an SMB?",
      "a": "It depends on your real need. For general assistance, mainstream writing and a rich extension ecosystem, ChatGPT is excellent. To integrate AI into your business tools, process long documents and keep a strict security frame, Claude takes the lead. The real question isn't which is better in absolute terms, but which best serves your priority use case."
    },
    {
      "q": "What is the main difference between Claude and ChatGPT?",
      "a": "ChatGPT goes broad: versatile assistant, image generation, voice, plugins, custom GPTs. Claude is built for rigorous work on text and code, with a very large context window and the MCP protocol that wires it cleanly to your tools. In short, ChatGPT is a mainstream Swiss army knife, Claude a business integration tool."
    },
    {
      "q": "Which is safer for company data?",
      "a": "Both offer enterprise plans that don't train models on your data. Anthropic puts safety and alignment at the heart of its proposition, which reassures for sensitive uses. But the real safety factor remains integration: a framed deployment with a clear usage policy protects far better than the choice of model alone. That's where guidance matters."
    },
    {
      "q": "How much do Claude and ChatGPT cost for a team?",
      "a": "Both sit around 20 to 30 € per user per month for pro plans, with enterprise tiers above. Subscription cost is rarely the decisive item. An SMB's real cost hides in integration time, training and automation maintenance. Comparing licence prices without looking at total cost of use leads to bad decisions."
    },
    {
      "q": "Is Claude better than ChatGPT for coding?",
      "a": "On complex code, refactoring and reasoning over large bases, Claude is regularly preferred by developers for its rigour and context window. ChatGPT remains very solid and its tooling ecosystem is rich. For an SMB, the issue isn't the raw benchmark but the ability to wire the model to your code and processes, which Claude makes easier via MCP."
    },
    {
      "q": "Can I connect Claude or ChatGPT to my business tools?",
      "a": "Yes for both, but through different routes. ChatGPT relies on its plugins, GPTs and connectors. Claude uses the MCP protocol, an open standard that links it cleanly to your databases, your CRM or your files, with no hacking. For a durable, maintainable integration in an SMB, this standardised approach is a clear point for Claude."
    },
    {
      "q": "Should you pick one tool or both?",
      "a": "Many SMBs use both: ChatGPT for daily individual assistance and Claude for agents integrated into their processes. That isn't incoherent. The mistake would be to multiply subscriptions with no frame, with sensitive data flowing everywhere. Better a framed use of one well-integrated tool than a scatter of underused ones."
    },
    {
      "q": "Why does Waimia recommend Claude for integration?",
      "a": "Because our job is to wire AI into your tools, and Claude's MCP protocol makes those integrations clean, standardised and maintainable. That doesn't disqualify ChatGPT, which stays excellent for general assistance. Our recommendation is nuanced: Claude for integrated business agents, and everyone picks the mainstream tool they prefer for individual assistance."
    }
  ],
  "sections": [
    {
      "type": "hero-split-media",
      "background": "paper",
      "media_src": "/images/line-art/dispositif-flow.svg",
      "media_alt_fr": "Schéma : deux assistants IA mis en regard, l'un orienté grand public, l'autre branché aux outils métier",
      "media_alt_en": "Diagram: two AI assistants set side by side, one mainstream-oriented, the other wired to business tools",
      "kicker_fr": "§ Comparatif Claude vs ChatGPT",
      "kicker_en": "§ Claude vs ChatGPT comparison",
      "h1_fr": "Claude vs <i class=\"acc\">ChatGPT</i> pour une PME.",
      "h1_en": "Claude vs <i class=\"acc\">ChatGPT</i> for an SMB.",
      "definition_kicker_fr": "De quoi parle-t-on ?",
      "definition_kicker_en": "What are we comparing?",
      "lede_fr": "Deux assistants IA excellents, deux philosophies. ChatGPT vise large : assistant grand public, écosystème riche. Claude vise <i>l'intégration</i> métier : contexte étendu, protocole MCP. Ce comparatif pose les forces, limites, coûts et la sécurité de chacun, pour choisir selon votre besoin réel.",
      "lede_en": "Two excellent AI assistants, two philosophies. ChatGPT goes broad: mainstream assistant, rich ecosystem. Claude goes for business <i>integration</i>: extended context, MCP protocol. This comparison lays out each one's strengths, limits, costs and security, to choose by your real need.",
      "badges": [
        {
          "label_fr": "Verdict nuancé · pro-intégration",
          "label_en": "Nuanced verdict · pro-integration"
        },
        {
          "label_fr": "Forces, limites, coûts, sécurité",
          "label_en": "Strengths, limits, costs, security"
        },
        {
          "label_fr": "Cas d'usage PME concrets",
          "label_en": "Concrete SMB use cases"
        }
      ],
      "cta_primary": {